{
  "contractVersion": "1.1.0",
  "corpusId": "shotgun-vp-finance-relation-candidate",
  "corpusVersion": "1.1.0",
  "labelSetRevision": 2,
  "corpusDigest": "sha256:c9fb7c0d514f6bcdf25038030616ea1feaa1ac31eaa4df39b8dedf46c800e9a4",
  "labelReviewStatus": "CANDIDATE",
  "dataClassification": "MIXED_USER_PROVIDED_AND_TEST_AUTHORED",
  "licenseSummary": "Short claim fragments from a user-provided PDF and test-authored companion claims; no external dataset.",
  "source": {
    "sha256": "bb413ea6a4864f4a0e21b8979b3f8eef1a9b99b42198eb1a8eef79e156b90d01",
    "pageCount": 10,
    "companionSourceId": "finance-companion-v1",
    "companionFile": "finance-relation-companion.v1.md"
  },
  "cases": [
    {
      "caseId": "finance-balance-sheet-identity",
      "left": "자산 = 부채 + 자본",
      "right": "기업의 자산은 부채와 소유주 자본의 합이다.",
      "allowedChoices": [
        "EQUIVALENT"
      ],
      "dimension": "cross-source-accounting-identity",
      "rationale": "Both state the accounting identity that assets equal liabilities plus equity.",
      "leftProvenance": {
        "page": 1,
        "markerId": "balance-sheet-identity"
      },
      "rightProvenance": {
        "sourceId": "finance-companion-v1",
        "claimId": "identity-paraphrase"
      }
    },
    {
      "caseId": "finance-current-ratio-calculation",
      "left": "유동비율 = 4,000 / 2,000 × 100 = 200%",
      "right": "유동자산 4,000만원을 유동부채 2,000만원으로 나눈 유동비율은 200%다.",
      "allowedChoices": [
        "EQUIVALENT"
      ],
      "dimension": "cross-source-numeric-ratio",
      "rationale": "Both use the same current-asset and current-liability amounts and report 200 percent.",
      "leftProvenance": {
        "page": 2,
        "markerId": "current-ratio-result"
      },
      "rightProvenance": {
        "sourceId": "finance-companion-v1",
        "claimId": "current-ratio-paraphrase"
      }
    },
    {
      "caseId": "finance-operating-profit-calculation",
      "left": "영업이익 = 900 − 500 = 400만원",
      "right": "매출총이익 900만원에서 판매비와관리비 500만원을 빼면 영업이익은 400만원이다.",
      "allowedChoices": [
        "EQUIVALENT"
      ],
      "dimension": "cross-source-numeric-result",
      "rationale": "The companion expands the same arithmetic and reports the same operating-profit result.",
      "leftProvenance": {
        "page": 3,
        "markerId": "operating-profit-result"
      },
      "rightProvenance": {
        "sourceId": "finance-companion-v1",
        "claimId": "operating-profit-paraphrase"
      }
    },
    {
      "caseId": "finance-profit-cash-distinction",
      "left": "이익이 증가했다고 해서 현금도 같은 금액만큼 증가한 것은 아니다",
      "right": "회계상 이익이 늘어도 현금이 같은 액수만큼 늘었다고 단정할 수 없다.",
      "allowedChoices": [
        "EQUIVALENT"
      ],
      "dimension": "cross-source-qualification",
      "rationale": "Both reject the inference that increased profit guarantees an equal cash increase.",
      "leftProvenance": {
        "page": 3,
        "markerId": "cash-vs-profit-distinction"
      },
      "rightProvenance": {
        "sourceId": "finance-companion-v1",
        "claimId": "profit-cash-paraphrase"
      }
    },
    {
      "caseId": "finance-positive-npv-rule",
      "left": "NPV > 0 → 투자로 기업가치가 증가하는 방향",
      "right": "NPV가 양수이면 투자로 기업가치가 증가하는 방향이다.",
      "allowedChoices": [
        "EQUIVALENT"
      ],
      "dimension": "cross-source-sign-condition",
      "rationale": "Both state the positive-NPV decision direction under the same condition.",
      "leftProvenance": {
        "page": 6,
        "markerId": "npv-positive-investment-direction"
      },
      "rightProvenance": {
        "sourceId": "finance-companion-v1",
        "claimId": "positive-npv-paraphrase"
      }
    },
    {
      "caseId": "finance-complementary-npv-branches",
      "left": "NPV > 0 → 투자로 기업가치가 증가하는 방향",
      "right": "NPV < 0 → 투자로 기업가치가 감소하는 방향",
      "allowedChoices": [
        "RELATED"
      ],
      "dimension": "mutually-exclusive-finance-conditions",
      "rationale": "The sign conditions differ; both rules can be true and are related rather than contradictory.",
      "leftProvenance": {
        "page": 6,
        "markerId": "npv-positive-investment-direction"
      },
      "rightProvenance": {
        "page": 6,
        "markerId": "npv-negative-investment-direction"
      }
    },
    {
      "caseId": "finance-irr-definition",
      "left": "NPV가 0이 되도록 만드는 할인율",
      "right": "IRR은 순현재가치(NPV)를 0으로 만드는 할인율이다.",
      "allowedChoices": [
        "EQUIVALENT"
      ],
      "dimension": "cross-source-definition",
      "rationale": "Both define IRR as the discount rate at which NPV equals zero.",
      "leftProvenance": {
        "page": 6,
        "markerId": "irr-definition"
      },
      "rightProvenance": {
        "sourceId": "finance-companion-v1",
        "claimId": "irr-definition-paraphrase"
      }
    },
    {
      "caseId": "finance-discount-rate-present-value",
      "left": "할인율이 높아질수록 현재가치는 낮아진다",
      "right": "같은 미래 현금흐름과 기간에서는 할인율 상승이 현재가치를 낮춘다.",
      "allowedChoices": [
        "EQUIVALENT"
      ],
      "dimension": "cross-source-directional-condition",
      "rationale": "The companion states the same inverse direction while making the held-constant scope explicit.",
      "leftProvenance": {
        "page": 6,
        "markerId": "discount-rate-present-value"
      },
      "rightProvenance": {
        "sourceId": "finance-companion-v1",
        "claimId": "discount-rate-paraphrase"
      }
    },
    {
      "caseId": "finance-beta-complementary-branches",
      "left": "β > 1: 시장보다 더 크게 움직이는 경향",
      "right": "β < 1: 시장보다 덜 민감하게 움직이는 경향",
      "allowedChoices": [
        "RELATED"
      ],
      "dimension": "mutually-exclusive-beta-conditions",
      "rationale": "These describe different beta ranges and can both be true for different assets; they are not contradictory.",
      "leftProvenance": {
        "page": 9,
        "markerId": "beta-above-one"
      },
      "rightProvenance": {
        "page": 9,
        "markerId": "beta-below-one"
      }
    },
    {
      "caseId": "finance-beta-1-5-example",
      "left": "β > 1: 시장보다 더 크게 움직이는 경향",
      "right": "베타가 1보다 큰 자산은 시장 변동보다 더 크게 움직이는 경향이 있다.",
      "allowedChoices": [
        "EQUIVALENT"
      ],
      "dimension": "cross-source-numeric-beta-example",
      "rationale": "Both give the same beta example and average directional relationship.",
      "leftProvenance": {
        "page": 9,
        "markerId": "beta-above-one"
      },
      "rightProvenance": {
        "sourceId": "finance-companion-v1",
        "claimId": "beta-above-paraphrase"
      }
    },
    {
      "caseId": "finance-npv-numeric-conflict",
      "left": "같은 예시에서 NPV = 1,150만원 − 1,000만원 = 150만원이다.",
      "right": "같은 투자 예시의 NPV는 140만원이다.",
      "allowedChoices": [
        "CONTRADICTS",
        "UNRESOLVED"
      ],
      "dimension": "same-scenario-numeric-conflict",
      "rationale": "If the companion refers to the same example, the claimed NPV values conflict; unresolved is safe if the shared scope is not established.",
      "leftProvenance": {
        "page": 6,
        "markerId": "npv-example"
      },
      "rightProvenance": {
        "sourceId": "finance-companion-v1",
        "claimId": "npv-alternative-value"
      }
    },
    {
      "caseId": "finance-profit-cash-coexistence",
      "left": "이익이 증가했다고 해서 현금도 같은 금액만큼 증가한 것은 아니다",
      "right": "이 예시에서는 이익이 증가했지만 해당 기간 현금은 증가하지 않았다.",
      "allowedChoices": [
        "SUPPORTS"
      ],
      "allowedDirections": [
        "RIGHT_TO_LEFT"
      ],
      "dimension": "non-implication-and-instance",
      "rationale": "The example on the right supplies a counterexample to equal profit/cash growth and therefore supports the broader non-implication on the left; the direction is right-to-left. The label remains a candidate pending independent review.",
      "leftProvenance": {
        "page": 3,
        "markerId": "cash-vs-profit-distinction"
      },
      "rightProvenance": {
        "sourceId": "finance-companion-v1",
        "claimId": "profit-up-cash-flat-example"
      }
    },
    {
      "caseId": "finance-unrelated-measures",
      "left": "유동비율 = 4,000 / 2,000 × 100 = 200%",
      "right": "영업이익 = 900 − 500 = 400만원",
      "allowedChoices": [
        "UNRESOLVED",
        "RELATED"
      ],
      "dimension": "different-financial-measures",
      "rationale": "Both concern financial management but measure distinct properties; do not merge their values.",
      "leftProvenance": {
        "page": 2,
        "markerId": "current-ratio-result"
      },
      "rightProvenance": {
        "page": 3,
        "markerId": "operating-profit-result"
      }
    },
    {
      "caseId": "finance-current-ratio-same-scope-conflict",
      "left": "같은 예시에서 유동자산 4,000만원, 유동부채 2,000만원의 유동비율은 200%다.",
      "right": "같은 예시의 유동비율은 150%다.",
      "allowedChoices": [
        "CONTRADICTS",
        "UNRESOLVED"
      ],
      "dimension": "same-scope-ratio-conflict",
      "rationale": "For the same example and amounts the ratio is 200 percent; if that scope is not preserved, leave the pair unresolved.",
      "leftProvenance": {
        "page": 2,
        "markerId": "current-ratio-result"
      },
      "rightProvenance": {
        "sourceId": "finance-companion-v1",
        "claimId": "current-ratio-alternative-value"
      }
    }
  ]
}
